,,,,,,,,,,,,,,,,,,,,,,,,,,,,,,,,,,,,,,,,,,,,,,,,,,,,,,,,,,,,,,,,,,,,,,,,,,
Item #6 Description,,,,,,,,,,"Sector Secrets Mastery is where Raghee shares her actual trades in real-time. With this quarterly membership, you’ll get ongoing guidance from Raghee as she targets swing trades and portfolio-building setups. This Mastery is your opportunity to follow her in live trading sessions five days a week.",,,,,,,,"Trading can be a lonely adventure. It’s better when we can continue our journey together. With Bruce’s Income Accumulation System (B.I.A.S.) Quarterly Membership, you get to connect with Bruce as he shares ideas during live chat room sessions while he manages his real money in the markets.

You'll get access to all of this:

- Real-time trade alerts
- Position Spreadsheets
- Access to the B.I.A.S Trading Room
- And so much more....",,We believe there’s no better way to deepen your mastery of the 5-Star Options Income Plan strategy than to watch Danielle as she looks for her 5-Star setups during her most profitable month of the year (January).,"This is your opportunity to watch Allison for special pre-recorded live sessions and see how she targets returns of 20% to 200% within a week’s time. These live sessions offer an opportunity to see how Allison analyzes the market and sets up her trades step-by-step. That means you’ll get to see exactly how she executes entries and exits. As always, any trades Allison takes are real and NOT hypothetical. We believe that these extra pre-recorded trading sessions are the fastest way to ‘make this strategy your own.’ The big benefit of the ‘double’ trading sessions is to see how Allison trades her strategy in different market conditions.",,,"Missing the point of entry causes traders to not only miss out on trades, many also expose themselves to a substantial amount of risk. That's why Joe Rokop created the Strike Zone method. He’s determined to help traders sharpen their skills as Joe uses his “no brainer” entry signals to catch consistent returns while calculating risk. Follow Joe’s “Strike Zone” setups in real-time. Become a member to attend a Q&A and join for a live trading session each month. The Strike Zone Mastery is for traders looking to consistently grow their accounts with a trading plan that works best with their lifestyle.

You'll get access to all of this:

- Monthly Interactive Live Trading
- Real-Time Trade Alerts
- Updated Trade Spreadsheet","During these two additional days, continue to watch Danielle to experience the full effect of her trades. Having all four days of recorded live-trading presents an incredible opportunity, giving you the chance to dive deeper into each individual trade, as you will have continued guidance for a longer period of time.

If you know how much you can learn and grow as a trader during just ONE live-trading session, imagine what FOUR could do?",,,,"Simpler Central is designed to help you stay up-to-date on futures, options, ETFs, stocks, and more. Having trading mentors is one of the most important things when learning to trade. Within our Simpler Central trading room, you can access our team which brings you 100+ years of trading experience. Instead of wading through fake gurus and hypothetical trades, join the Simpler Team to see their actual trades and strategies in real-time. Acess our entire team of trading mentors to see why traders say they wish they wish they’d found us sooner.",,,,,,,,"The goal of Raghee’s flagship membership is to help unlock her “secrets” to day trading, swing trading, and long-term portfolio management. Get ongoing guidance from Raghee weekly, as she trades using her timeless strategies in any environment with portfolio-building setups. With a 30-year veteran giving you direct trade alerts, it’s almost like you gained all the knowledge and wisdom without all the years! Included with this membership is access to our Simpler Essentials room.",,,,,,,This tool is designed to identify exactly when momentum is turning. And Tr3ndy uses these easy-to-understand arrows to pinpoint precise entries at the PMZ levels.,,,,,,,,,,,,,,"This Quickstart Indicator Training is designed to help you start using the Volume Max Tool Package quickly and efficiently. Learn from the inventor of this indicator, Raghee Horner, and use this indicator how it was meant to be used. You will receive 5+ hours of recorded live trading of the markets and get to watch Raghee's setups on a real live account.",,,,,,,,,,,,,,A spreadsheet that helps you keep track of the 25 A+ trades that you'll be taking!,,
"Introduce your bonuses

Example:
The Sandbox Strategy includes these bonuses:",,,,The Sandbox Strategy includes these bonuses:,,,,,The Micro Voodoo Lines Strategy includes these bonuses:,,The Chart Patterns Secrets includes this bonus:,The Stacked Profits Strategy includes these bonuses:,The Multi Squeeze Pro System includes this bonus:,,,,The True Momentum System includes these bonuses:,,,NOT BONUSES BUT RAN OUT OF SPACE,,,,,NOT BONUSES BUT RAN OUT OF SPACE,"When you sign up, you also get these exclusive bonuses:",,,"Additionally, as a Simpler Central member, you have access to:",,,,,,,,,,,,The R.A.F Pro!® includes these bonuses:,,,,,,,,,,,"Plus, you get 3 powerful bonuses:",,"Plus, you get 2 powerful bonuses:",,You Get 3 Powerful Bonuses!,"Plus, You Get 2 Priceless Bonuses!",You Also Get 2 Powerful Bonuses,,,More about what's included in these packages:,,,,"Plus, you get 2 powerful bonuses:",,,,,"Plus, you get 2 powerful bonuses",Get Instant Access to Chris’s New Private Training Session Recordings,,,
"Bonus Item #1 Title:

Example:
Pro Bonus: Two Days of Recorded Live Trading",,,,Pro Bonus: Two Days of Recorded Live Trading,,,,,Bonus: Futures 101 Class,,Bonus: Unusual Options Activity Class,"Pro and Elite Bonus: ""7 Stocks to Success"" Class",Pro and Elite Bonus: Multi Histogram Indicator,,,Bonus: Options 101 Class Recording with John Carter,"BONUS: Swing Levels Pro Indicator
",,,Ready Aim Freedom Class,,,,,Trendstrength Turbo Candles,E-Learning Module,,,Central Live Trading Chatroom,,Intro to Futures,Futures Beginner Trading Session ,,Moxie Scans for ThinkOrSwim (TOS),,,,BONUS CLASS - How Bruce uses thinkorswim®,,,The New R.A.F!® Pro Scan,,,,,,,,,,,"Phoenix Folio 1, 2 & 3",,The Quickstart Indicator Training,,5 Recorded Live Trading Sessions,Indicator Setup with Eric Purdy,Indicator Setup with Eric Purdy,,Indicator Setup with Eric Purdy,Small Account Mentorship (Quarterly),Indicator Setup,,,Indicator Setup,Indicator Setup with Eric Purdy,,,,Indicator Setup with Eric Purdy,How Chris Exploits 0-DTE with Simple Chart Patterns,,,
"Bonus Item #1 Description

Example: 

Watch John Carter live trade the Sandbox Strategy in real-time. You'll see how he plans and executes the trades. Review the recordings whenever you want because you get lifetime access.",,,,Watch John Carter live trade the Sandbox Strategy in real-time. You'll see how he plans and executes the trades. Review the recordings whenever you want because you get lifetime access.,,,,,"If you’re new to trading options and futures, these classes give you exactly what you need to know without bogging you down with confusing jargon or needless theory. You’ll learn the “Simpler way” to trade them so that you’re prepared to take full advantage of the new Micro Voodoo Lines Strategy right away.",,"Chris reveals how unusual options activity can show which chart patterns are the strongest and most likely to take off. This is a great strategy to use when trading earnings. In this training, Chris shows you how he takes full advantage of these opportunities.","Danielle is offering a FULL class as a bonus. You’ve probably heard Danielle discuss her 3-hour per-day, 4-day work week. And now she’s put the formula together just for you as a recorded class. This is the strategy that helped her become the professional trader she is today. The best part? It’s simple, and you can take action right away.",The Multi Histogram Indicator is designed to help you tell the difference between an opportunity for a quick profit from a potential monster move (like John’s $611k AMZN trade). The goal is to see when momentum and Squeeze Pro setups are all “aligned” in the same direction without having to look at 18 charts individually. The power this gives you is something you truly have to see for yourself.,,,"If you’re new to options, this training gives you exactly what you need to know without bogging you down with confusing jargon or needless theory. You’ll learn the “Simpler way” to trade options so that you’re prepared to take full advantage of the strategy John’s teaching on Saturday.
","Sam designed this simple tool to identify highs and lows for trading volatile range conditions. The lines plot automatically and are designed to work in conjunction with the Hi Lo Pro X arrows for identifying entries and exits.
",,,"The Ready Aim Freedom Class is designed for newer traders who want to grow smaller accounts while catching quick, directional trends. This course includes:

- Learning how Danielle identifies setups with lower risk using simple setups she’s refined over the past 5 years. These are the same “bread and butter” trades that allowed her to quit her teaching job to raise her toddler son from home full-time.

- Discovering how Danielle adapted some of Simpler Trading’s most popular strategies for newer traders with smaller accounts. Her system combines proven strategies from John Carter, Henry Gambell, and the simpler team.

- How to spot strong trends for directional option plays. You’ll get Danielle’s “Trend is Your Friend” checklist so you can look at ANY chart and know instantly if a setup is worth risking your money.

- Danielle’s squeeze checklist for smaller accounts. Not all “squeezes” are created equal, and now you can learn how to pick the best ones. Her checklist is designed to quickly spot squeezes with the greatest potential with the least risk.",,,,,"This tool is a collaboration between several tools. Danielle’s Trend Strength Turbo Candles, which populate based on price in relation to the moving averages and how the moving averages are stacked, AND the 10X Indicator, which identifies volume and momentum. This creates perfect harmony to help identify trend + volume/momentum. Plus, these candles work fantastically with the Options Freedom Formula and Phoenix Finder Indicator because they help solidify a trader’s decision for entering a setup on a strong ticker.

Available for ThinkorSwim and TradeStation.","Also part of this package is the E-Learning Module. All the important sections of the course are presented in video modules that are organized into specific training topics. Like all recorded sections of this package, you can watch, study, and watch again everything the course has to offer from anywhere you have internet access — your phone, tablet, and computer. Your course is available on demand for your convenience.",,,or more than a decade our community has come together from open to close in order to identify potential trade setups. Watch our charts in real time during interactive online sessions.,,,"The futures market is one of the best-kept secrets of successful traders. Even if you’ve only ever participated in stocks, options, or ETFs, you’ll find the futures market offers unmatched leveraged profit potential without the complexity of watchlists or options “greeks.”

Don’t know anything about futures yet? That’s okay. By the end of this special pre-recorded training, you’ll understand exactly what you need to know to start trading futures right away.",,"This is the number one way that TG finds his timely and explosive trades. His favorite setup, the Trampoline Move, which you’ll learn about in his class, can be found using the scanner for the daily and hourly time frames. With this additional information, you can then find when a trend starts or ends using the Moxie Price Trigger.",,,,"Also, the Premium Package includes the Bonus Class: How Bruce Uses thinkorswim® (known as “ToS”). ToS is a free platform that provides real-time market data and is commission-free. You can use it to follow Bruce’s setups and plan trades even if you have another broker. Bruce’s special tutorial covers exactly how he uses the ToS Analyze tab to find setups while modeling and visualizing risk.

Bruce uses his 30+ years trading experience to get the most from this popular options platform. Now you can apply the same tips and tricks and avoid common (costly) mistakes.

Fact is, ToS includes pro-grade tools that should be your “profit command center.” You can model almost any kind of position with only a few mouse clicks. This allows you to forecast potential gains (and losses) — without risking a dime. ToS can show exactly what strategy to use (and which to avoid!). It’s almost a secret weapon because so many traders don’t know how it works. Take advantage of Bruce’s step-by-step ToS tutorial as he shares powerful tips and tricks. If you’re serious about generating options income, this is a critical skill.",,,"With the Ready. Aim. Fire!® Pro Scan, it’s now quick and easy to identify reversals without having to manually look at each chart. So many traders get stuck in bad trades because they don’t have a proven way to find opportunities where they have a true edge. This scan puts that power at your fingertips. Currently available on TOS and TradeStation.",,,,,,,,,,,Also included is the Phoenix Folio. This is a collection of Danielle’s handpicked stock lists. These baskets of stocks are broken down personally by Danielle into different lists to help you identify which tickers fit your trading strategy the best. Phoenix Folio presents a clear advantage when searching for the “best in breed” stocks. These lists contain the stocks that she trades for strong setups.,,"This indicator is designed to help you start using the Divergent Bar quickly and efficiently. Learn from the inventor of this indicator, Allison Ostrander, and use this indicator how it was meant to be used.

Available for ThinkorSwim, Tradestation, TradingView, and TastyTrade. Bonus scans are only available for ThinkorSwim.",,"The first recorded Live Trading Session will feature Danielle Shay and David Starr, and the second session will be with Henry Gambell and David Starr. The third session will be David Starr only. During our recorded live-trading sessions is when everything you’ve learned in the Strategy class comes together and you’ll see how David Starr, Henry Gambell, and Danielle Shay use Voodoo Lines in real-time. Recorded Live-trading is the best way we’ve found to improve trading skills in just a few days. Learn how the creator of these powerful indicators trades in a recorded live trading session. You will learn strategies that have a high probability of success and profit.",A recorded installation session by our one and only Eric Purdy. ,A recorded installation session by our one and only Eric Purdy. ,,A recorded installation session by our one and only Eric Purdy. ,"There’s no better way to deepen your mastery of Kody’s strategy than to get weekly Small Acocounts Mentorship sessions to help you stay on track. These sessions will allow you to get your questions answered, get up-to-date market insights, and take live trades when SAM setups form. Pro package comes with a 30 day trial and the Elite package gives you access to the Quarterly membership. Your membership will renew every quarter at $597 and you can cancel at any time.",Indicator installation session with David Star himself. ,,,"Getting your new Early In-N-Out Pro Tool setup and ready to go is quick and easy because the creator of these powerful tools, Eric Purdy, will walk you through everything step by step in a prerecorded session.",A recorded installation session by our one and only Eric Purdy. ,,,,A recorded installation session by our one and only Eric Purdy. ,,,,
Bonus Item #2 Title,,,,Live Tech Support,,,,,Bonus: Options 101 Class,,, Bonus: Kickstart to Victory,,,,,"Elite BONUS: Advanced True Momentum
",,,Simpler Central Membership (Quarterly),,,,,Simpler Central Membership (Quarterly),Recorded Pre Class Live Trading,,,Trade Alerts,,Quick Start Materials,,,Improved Moxie Watchlist,,,,,,,The New R.A.F!® Pro Scan Quickstart,,,,,,,,,,,Strategy Class,,Lifetime Updates and Live Tech Support,,Indicator Setup with David Starr,Lifetime Updates and Live Tech Support ,Lifetime Updates and Live Tech Support ,,Lifetime Updates and Live Tech Support ,Squeeze Pro Indicator,Lifetime Updates and Live Tech Support,,,Lifetime Updates and Live Tech Support,Lifetime Updates and Live Tech Support ,,,,Lifetime Updates and Live Tech Support ,The Only Market Correlations That Really Matter,,,
Bonus Item #2 Description,,,,Watch John Carter live trade the Sandbox Strategy in real-time. You'll see how he plans and executes the trades. Review the recordings whenever you want because you get lifetime access.,,,,,"If you’re new to trading options and futures, these classes give you exactly what you need to know without bogging you down with confusing jargon or needless theory. You’ll learn the “Simpler way” to trade them so that you’re prepared to take full advantage of the new Micro Voodoo Lines Strategy right away.",,,"Need help getting your charts setup? Danielle walks you through her chart settings, Fibonacci settings and retracements, order entries, and other questions in this recorded session. Check it out in the Kickstart to Victory.",,,,,"For those who want to dive deeper into what Sam’s True Momentum System can do, Sam is doing an advanced bonus training for the Elite Package. He’s covering how to identify momentums in time when momentum is leading price – such as positive and negative divergence. You don’t need the advanced training to get the full benefit of Sam’s new True Momentum System. However, the additional insights have the potential to add a whole new dimension to trade analysis.
",,,"Simpler Central is designed to help you stay up to date on everything options related. Within Simpler Central, you have access to our team that brings 100+ years of trading experience. Having trading mentors is one of the most important things when learning to trade. We don’t want you to waste your time wading through business after business, trying to find an experienced trader you can trust to guide you in the right direction. That’s one of the main reasons Simpler Central is so loved, you have access to an entire team of trading mentors.",,,,,"Simpler Central is designed to help you stay up to date on everything options related. Within Simpler Central, you have access to our team that brings 100+ years of trading experience. Having trading mentors is one of the most important things when learning to trade. We don’t want you to waste your time wading through business after business, trying to find an experienced trader you can trust to guide you in the right direction. That’s one of the main reasons Simpler Central is so loved, you have access to an entire team of trading mentors.","Want to watch a recording of what Joe’s formula can do before you take the class? If the answer is yes, you should definitely check out this bonus trading session. Think of it as a delicious appetizer to the main trading course.",,,"We know that not everyone can watch the market all day. As a Simpler Central member, you can follow our trades in real time as we offer instant alert services.",,,,,"The Improved Moxie Watchlist takes advantage of the fast moves we’ve been seeing in the market by showing you where Moxie is at on each of your tickers in a color-coded glance. Looking for a strong mover? Simply look for a ticker that has all green bars. Want to know which ticker on your list is about to fire? The watchlist shows you instantly with a stand-out color that you can clearly see as you scroll through. And if the market is a mess, the Moxie Watchlist reflects that.",,,,,,,"With the Ready. Aim. Fire!® Pro Scan Quickstart, you get to learn from David Starr, the creator, to quickly get up to speed on finding the best trades and setups without having to manually look at each chart. Currently available on TOS and TradeStation.",,,,,,,,,,,"This is for traders wanting more guidance from Danielle. In addition to everything with the Phoenix Finder Indicator, you get a recorded class where Danielle provides a deep dive into the Phoenix Finder tools and strategies. Follow along in the Strategy Class where Danielle explains how the Phoenix Finder is designed to catch precise up and down swings.",,"Simpler Trading's award-winning technical support team will help you with any issue you may have! Call in during regular business hours and we will always be able to solve your problems through email or over the phone. Once you're a Simpler Trader, you are for life.

You will have access to the Divergent Bar Indicator for life with this package.",,"Getting your new Voodoo Lines® Indicator setup and ready to go is quick and easy because the creator of these powerful tools, David Starr, will walk you through everything step by step in a pre-recorded session.","Any future updates will be sent out to these clients; in addtion to that, they can always call our support team for assistance. ","Any future updates will be sent out to these clients; in addtion to that, they can always call our support team for assistance. ",,"Any future updates will be sent out to these clients; in addtion to that, they can always call our support team for assistance. ","We’re extending you this opportunity to add the Squeeze Pro to your trading toolbox. As you may know, the Squeeze Pro Indicator was created by our founder, John Carter, to catch bigger and faster moves than the original Squeeze Indicator. This tool makes it possible to get into trades earlier and identify more opportunities.","Any future updates will be sent out to these clients; in addtion to that, they can always call our support team for assistance. ",,,"Simpler Trading's award winning technical support team will help you with any issue you may have! Call in during regular business hours and we will always be able to solve your problems through email or over the phone. Once you're a Simpler Trader, you are for life.

You will have access to the Early In-N-Out Pro Tool for life with this package.","Any future updates will be sent out to these clients; in addtion to that, they can always call our support team for assistance. ",,,,"Any future updates will be sent out to these clients; in addtion to that, they can always call our support team for assistance. ",,,,
Bonus Item #3 Title,,,,,,,,,,,,,,,,,,,,,,,,,,Futures 101 Class,,,Premium Newsletter,,,,,,,,,,,,"Indicator Setup 
",,,,,,,,,,,Simpler Central Membership (Quarterly),,,,Lifetime Updates and Live Tech Support,,,,,,,,,,,,,,,,,,
Bonus Item #3 Description,,,,,,,,,,,,,,,,,,,,,,,,,,"Joe has years of experience coaching new traders. To get you up to speed as fast as possible, Joe recorded a special bonus session that gives you what you need to know to get started with futures in a flash. Some of the topics covered within this class are margin section, stop loss section, and micro/mini summary charts.",,,"Every week night, you’ll get premium videos from the trader who runs your membership with valuable info that reviews the previous day’s trades and prepares you for the next trading day.",,,,,,,,,,,,Getting your new indicators and charts set up and ready to go is quick and easy when we walk you through everything step-by-step in a special pre-recorded session. We also answer many indicator-related or setup questions. You can watch them again whenever you want.,,,,,,,,,,,"Within Simpler Central, you have access to our team that brings 100+ years of trading experience. Having trading mentors is one of the most important things when learning to trade. We don’t want you to waste your time wading through business after business, trying to find an experienced trader you can trust to guide you in the right direction. That’s one of the main reasons Simpler Central is so loved, you have access to an entire team of trading mentors.",,,,"Simpler Trading's award winning technical support team will help you with any issue you may have! Call in during regular business hours and we will always be able to solve your problems through email or over the phone. Once you're a Simpler Trader, you are for life. Any future updates of the Voodoo Lines® Futures/Forex/ETF Indicator will be provided for free for life with this package. The Stock Package is a $47/mo subscription.",,,,,,,,,,,,,,,,,,
Bonus Item #4 Title,,,,,,,,,,,,,,,,,,,,,,,,,,,,,Weekly Watchlist,,,,,,,,,,,,Lifetime Updates and Live Tech Support,,,,,,,,,,,,,,,,,,,,,,,,,,,,,,,,,
Bonus Item #4 Description,,,,,,,,,,,,,,,,,,,,,,,,,,,,,Receive a curated list of tickers that our trading experts are keeping an eye on (Which will be posted by the end of the day every Monday) along with a “rundown” explaining the picks.,,,,,,,,,,,,"Simpler Trading's award winning technical support team will help you with any issue you may have! Call in during regular business hours and we will always be able to solve your problems through email or over the phone. Once you're a Simpler Trader, you are a Simpler Trader for life.",,,,,,,,,,,,,,,,,,,,,,,,,,,,,,,,,
