,,,,,,,,,,,,,,,,,,,,,,,,,,,,,,,,,,,,,,,,,,,,,,,,,,,,,,,,,,,,,,,,,,,,,,,,,,
Item #2 Description,,,,The Quant Pivots define the boundaries of the “sandbox” where the algorithms trade. Historical data reveals the extreme edge of this range holds up to 95% of the time. ,,,,,"David Starr’s intraday Micro Voodoo Lines® are designed to expose dynamic support and resistance levels in the most actively traded stock indexes (and select stock symbols). Because the market is ever-changing, David updates the Micro Voodoo Lines® periodically. Available for ThinkorSwim and TradingView.","Daily Price Movement Range (DPMR) is a 6-month historical look back of daily price movement ranges. This means you can now decide on prices for entries, targets, and exits that are based on historical data. This is for trades that last from 24 hours to weeks. HPMR is for day trading and is NOT part of this class.","Get 2 days of pre recorded live trading sessions with Chris Brecher. Watch his screen as he targets chart pattern setups during market hours. During these sessions, you’ll see Chris demonstrate his strategy in step-by-step detail.",Take advantage of Danielle’s popular recorded live-trading sessions that help bring together everything you learned in the Strategy Class by following recordings of Danielle’s trading during market hours. Make this strategy your own by quickly turning your new knowledge into action. Watch over Danielle’s shoulder as she looks for “Stacked Profits” setups and dive deeper into this effective strategy.,"The Multi Squeeze Pro indicator takes the Squeeze Pro to the next level when it comes to finding high-probability setups. For the first time, you can see when a symbol has the strongest Squeezes aligned across up to 18 time frames. That includes ‘hidden’ time frames most traders don’t know exist!","During this training, Raghee reveals how she consistently day trades options and targets steady account P&L growth with proven tools she’s refined over 35 years. Raghee will walk you through how she knows exactly when to buy, sell, or stay out on trending or range days. Complete recordings are included.",,"Ready. Aim. Fire!® Pro System takes the proven trade timing technology to the next level. It’s designed to help identify when a support or resistance level is likely to hold with a precise trigger for entry and exit targets. Built in alerts identify upcoming turns with an objective 3-step process. The goal is to catch tops, bottoms, and retracements with tight stops. Now, this upgraded version is finally available exclusively with John’s class. Currently available for ThinkorSwim and TradeStation.
","The NEW Hi Lo Pro X includes code refinements that are new to this version and designed to work within the True Momentum System. The indicator includes automated scans. The HiLo Pro X oscillator is designed to reveal entries and exits with built-in timing arrows that help Sam pinpoint when to execute trades. The HiLo Pro X identifies significant oversold and overbought conditions with as little “noise” or false signals as possible. It also now reveals the thrust of a move, which is the first stage of True Momentum.

Available for ThinkOrSwim (TOS) and TradingView","Included in this package is the E-Learning Module. All the important sections of the course are presented in video modules that are organized into specific training topics.

Like all recorded sections of this package, you can watch, study, and watch again everything the course has to offer from anywhere you have internet access — your phone, tablet, and computer.","Join our trading room moderator, Lorna St. George, where she’ll walk you through installing your new indicators. With this Recorded Pre-Class Tech session, Lorna will show you how to install Raghee’s indicators on your platform so you can be ready for class.
","In this recorded 1-hour session Danielle covered the essential keys to mastering the trading mindset. A disciplined trading mindset is the key for long-term success. Learning to master your emotions is so much easier with proven trader psychology principles.

In this exclusive training, Danielle is joined by John Carter, the founder of Simpler trading. He’s a bestselling author and 8-figure trader. John shares insights from his 35+ years experience. Discover the mindset secret behind his TEN 7-figure trades.","Strategy Class ($697 Value)

Divergent Bar Indicator ($497 Value)

Ultimate guide to Vertical Spreads ($197 Value)

Compound Breakout Tool ($297 Value)

2 Days Recorded Pro Live Trading ($400 Value)",,,"Joe has years of experience coaching new traders. To get you up to speed as fast as possible, Joe recorded a special bonus session that gives you what you need to know to get started with futures in a flash. Some of the topics covered within this class are margin section, stop loss section, and micro/mini summary charts.","Also part of this package is the E-Learning Module. All the important sections of the course are presented in video modules that are organized into specific training topics.

Like all recorded sections of this package, you can watch, study, and watch again everything the course has to offer from anywhere you have internet access — your phone, tablet, and computer.

Your course is available around the clock for your convenience.","This is your opportunity to watch a recorded trading session with Joe Rokop. We believe there’s no better way to deepen your understanding of Joe’s Strike Zone than to watch him as he looks for potentially big winning setups. Watching Joe’s trading sessions offer the fastest way to “make these tools your own” because you get to immediately watch him apply his strategy in real market conditions. As always, our informal goal is to strive to make enough profit to more than pay for your investment in your tools (obviously, no promises).",,"/h3 As part of this exclusive offer you can also get the recordings of Henry live trading the Unbalanced Butterfly!

It’s like watching over Henry’s shoulder to learn how he stacks the odds in his favor. These live-trading recordings let you see exactly how Henry identifies and executes this strategy in real market conditions. This is the best way to take action on what you discover in the strategy class.","The course is conveniently arranged into easy-to-follow E-Learning Modules. All sections of the course are presented in video modules that are organized into specific training topics.

Like all recorded sections of this package, you can watch, study, and watch again everything the course has to offer from anywhere you have internet access — your phone, tablet, or computer.

Your course is available around the clock for your convenience.

","Also part of this package is the E-Learning Module which presents all the important sections of the course in video modules that are organized into specific training topics.

This system allows you to follow the course in bite-sized segments on your computer, tablet, or smartphone. These simpler modules allow you to stay connected with the course material while on a lunch break, between tasks at home, or any point where you have limited time. All course information is included so you can watch and learn at your own pace.","Get the Pro Package and you’ll not only get the class but also two recorded trading sessions with Joe. Watch his screen in real-time as he targets more advanced swing trades on longer-term timeframes. During these sessions, you’ll see Joe demonstrate his strategy in step-by-step detail. ","Also part of this package is the E-Learning Module which presents all the important sections of the course in video modules that are organized into specific training topics.

This system allows you to follow the course in bite-sized segments on your computer, tablet, or smartphone. These simpler modules allow you to stay connected with the course material while on a lunch break, between tasks at home, or any point where you have limited time. All course information is included so you can watch and learn at your own pace.","The True Low indicator is Allison’s proprietary indicator designed to identify the “best” price to buy a stock. This indicator is responsible for $2,100+ gains in under 3 months. It’s designed to help stock traders buy as close to “True Low” prices as possible.

The True Low indicator is a breakthrough tool that uses Allison’s proprietary formula to identify when a stock has finished falling and is positioned to rally. Along with the ability to signal lowest price entries, Allison uses the indicator to help keep her OUT of bad trades as much as possible.","This is your opportunity to apply the tool that looks beyond price to identify big moves in stocks before they happen. TG wouldn’t trade a day without the Moxie Indicator™. It’s the secret weapon behind his ability to pick precise stock trades. Besides its ability to pinpoint killer stock picks that follow a strict checklist focusing on account growth, the indicator and TG’s pre-trade checklist help keep him OUT of account killing trades.",,,This indicator is a simpler way to visualize trend strength and gives entry signals and stop levels based on their relationship to current price.,"This is the next step that takes the Simpler Calendars Strategy Class and combines it with Live Trading Recordings with Bruce.

You can follow Bruce’s demonstration of exactly how to apply this strategy during market hours. These recorded live trading sessions bring together everything you learned in the Strategy Class.

We’ve shown from years of experience that a faster way to absorb and internalize this strategy and make it your own is by immediately using your new knowledge using live-market examples.

Class members tell us there’s nothing like being able to watch over Bruce’s screen in these recordings as he identifies “set and forget” positions for consistent profits.","Plus, together with the new Reversal Arrows, the Multi-10x Bars aims to catch reversals right when they start. This multiple timeframe approach aims to get better entries and exits and allow for tighter stops.",,"With the Ready. Aim. Fire!® Pro Scan, it’s now quick and easy to identify reversals without having to manually look at each chart. So many traders get stuck in bad trades because they don’t have a proven way to find opportunities where they have a true edge. This scan puts that power at your fingertips. Currently available on TOS and TradeStation.","Getting your new Squeeze Pro Indicators setup and ready to go is quick and easy because the creator of these powerful tools, Eric Purdy, will walk you through everything step by step in a pre-recorded session.",,"They’re perfect for intraday and set-it-and-forget-it plays. The Tr3ndy PMZ script (which includes the lower radar, watchlist, and PMZ risk indicators), plots a specific trend-based “pre-market zone” each morning about 10 minutes before the opening bell on any symbol. Use this zone to quickly find trigger prices and define your risk on intraday and scalp entries.",,TG’s scanner works to identify profitable setups as the market presents them. It’s now quick and easy to identify opportunities without having to manually look at each chart. This makes it possible to simply select the best trades and thereby only target setups with the highest profit potential. So many traders get stuck in bad trades because they don’t have a proven way to find opportunities where they have a true edge. This scan brings that power to your fingertips.,"The new QuantPivots Scan is also available with this offer. If you want to identify the highs and lows on any chart on your watchlist where the “Algo Bots” are likely to turn the market, these new scans make it quick and easy.
This one feature makes it possible to strategically target major reversals without having to manually look at each chart you follow. It’s a massive time-saver and unlocks the full potential of John’s strategy to trade WITH the Algo Bots instead of against them.",,,,,,,,,A deep dive into the best practices to take advantage of the edge the Voodoo Lines® Indicator offers.,,"A non-lagging oscillator that alerts us to when the markets have gone too far out on a limb, where the big money flows will and won’t play. VScore shows where there is support and resistance that market doesn't know is there, while allowing us to see submarket trends. VScore is the most powerful secret weapon oscillator of big money flow. VScore simplifies the three levels the big guys watch and it works for intra day and end-of-day.",The custom watchlists and scans helps the trader to build a process around earnings that they can build on season after season. ,,The Follow along with Kody as he demonstrates how he executes this incredibly simple strategy each morning in the first 30 minutes of the trading day. Having all twelve sessions that span out over weeks is a fantastic opportunity to give you the chance to dive deeper into the 1% a day strategy as you’ll have more days to watch him use his strategy in the market for a longer period of time.,The sessions shows how David goes about using the indicator in a real time environment. ,,,,,,,,,Follow Chris’s real money trades from anywhere with our mobile app,,Take advantage of this special opportunity to see how Danielle’s Overnight Earnings Method was expressed in real-time. Live-trading with a mentor is the fastest way we’ve found to master new trading strategies.,
Item #3 TItle,,,,Quick Hits Indicators,,,,,5 days of Recorded Live Trading,Long Term Portfolio Management:,2 Day Recorded Elite Live Trading,Simpler Essentials Membership ,4 days of Recorded Live Trading,HPMR Indicator,,"2 Day Recorded Pro Live Trading
",Trend Oscillator X Indicator + Scans,TOS Analyze Tab,"Recorded Long Term Portfolio Managment Session
",Squeeze Indicator,/h3 Elite $1097,Live Trading Recordings,,2 Day Recorded Pro Live Trading,Phoenix Finder Indicator,Strike Zone Mastery,Small Account Mentorship,Simpler Central Monthly,Earnings Hot Zone Indicator,Earning Analysis Indicator,Elite Live Trading,Recorded Pro Live Trading,Small Account Mentorship Trial,2 Days Pro Recorded Live Trading,,,Recorded Indicator Installation Session:,BIAS Quarterly Membership,10X Bars,,The New R.A.F! Pro Scan Quickstart,Lifetime Updates and Live Tech Support,,/h3 The Tr3ndy Bands,,TG's Moxie Indicator Stock Watchlist for TOS,Indicator Setup with Duncan Boggs,,,,,,,,,,,The New VProfile Indicator,,,Simpler Essentials,,,,,,,,,,Interactive Q&A,/h3 Squeeze Basics Video ,Danielle’s Quarterly Profits Class Elite Package,
